{"$schema":"https://json-schema.org/draft/2020-12/schema","$id":"https://lifecycle-spec.local/schemas/v0.1/monitoring-plan.json","title":"Monitoring Plan","type":"object","additionalProperties":false,"required":["version","generated_at","hostname","recommendations"],"properties":{"version":{"const":"infrascout.monitoring/v1"},"generated_at":{"$ref":"defs.json#/$defs/rfc3339DateTime"},"hostname":{"type":"string","minLength":1},"recommendations":{"type":"array","items":{"type":"object","additionalProperties":false,"required":["id","target_id","collector","priority","reason"],"properties":{"id":{"type":"string"},"target_id":{"type":"string"},"collector":{"type":"string"},"priority":{"enum":["required","recommended","optional"]},"reason":{"type":"string"},"parameters":{"type":"object","additionalProperties":{"type":"string"}}}}},"coverage_gaps":{"type":"array","items":{"type":"string"}}}}
